{
  "provenance": {
    "artifact_id": "wgf:evaluation:opp-001:20261002-01",
    "artifact_type": "evaluation",
    "schema_version": "1.0.0",
    "opportunity_id": "opp-001",
    "produced_by": {
      "role": "analysis",
      "actor": "ai"
    },
    "produced_at": "2026-10-02T09:00:00Z",
    "inputs": [
      {
        "artifact_id": "wgf:opportunity:opp-001:20260828-01",
        "artifact_type": "opportunity",
        "content_hash": "sha256:5ce59873b47b07de72725ed2808bead817eddfe2c30259a4f491405a524227d3"
      }
    ],
    "content_hash": "sha256:08be22e3d63322cdcfba7198afe7713dbbb57563243430f5ea4841f83173a5a7",
    "status": "final"
  },
  "id": "eval-0b02",
  "opportunity_id": "opp-001",
  "scoring_model": {
    "id": "portfolio-default",
    "version": "1.0.0",
    "file_hash": "sha256:c07e3b9142da6f8501eb47c3a29d6150fb8e24079c3d5a6188be4207fd93ca6e"
  },
  "scored_by": {
    "role": "analysis",
    "actor": "ai",
    "ai_provider": "example-provider",
    "ai_model": "example-model"
  },
  "dimensions": [
    {
      "id": "revenue_potential",
      "raw": 3400,
      "normalized": 0.58,
      "weight": 0.07,
      "tier": "hypothesis",
      "evidence_refs": [],
      "rationale": "No comparable revenue data was found for this category on Yandex.",
      "below_min_evidence_tier": true
    },
    {
      "id": "platform_fit",
      "raw": 0.78,
      "normalized": 1.0,
      "weight": 0.12,
      "tier": "observed",
      "evidence_refs": [
        "claim-0a02"
      ],
      "rationale": "Rewarded video is supported and Russian localization is required (claim-0a02). The other half of eval-0b01's case - one-touch input matching the category norm - rested on claim-0a01, which is unsupported (claim-0a05) and no longer cited."
    },
    {
      "id": "dev_speed_days",
      "raw": 11,
      "normalized": 0.63,
      "weight": 0.055,
      "tier": "hypothesis",
      "evidence_refs": [],
      "rationale": "eval-0b01 cited claim-0a03 (a claim about control idioms, not about scope) and called this derived. No claim measures it: hypothesis.",
      "below_min_evidence_tier": true
    },
    {
      "id": "monetization_fit",
      "raw": 0.75,
      "normalized": 0.75,
      "weight": 0.045,
      "tier": "hypothesis",
      "evidence_refs": []
    },
    {
      "id": "retention_potential",
      "raw": 0.45,
      "normalized": 0.45,
      "weight": 0.04,
      "tier": "hypothesis",
      "evidence_refs": [],
      "rationale": "Score-chase retention without a metagame is historically weak; weight halved as hypothesis."
    },
    {
      "id": "scope_complexity",
      "raw": "s",
      "normalized": 0.8,
      "weight": 0.04,
      "tier": "hypothesis",
      "evidence_refs": [],
      "rationale": "eval-0b01 cited claim-0a03 (a claim about control idioms, not about scope) and called this derived. No claim measures it: hypothesis."
    },
    {
      "id": "technical_risk",
      "raw": 0.6,
      "normalized": 0.4,
      "weight": 0.04,
      "tier": "hypothesis",
      "evidence_refs": [],
      "rationale": "Web audio latency is the dominant risk and it sits on the core mechanic. eval-0b01 marked this derived with no evidence; with no evidence_refs it is a hypothesis."
    },
    {
      "id": "asset_cost",
      "raw": 320,
      "normalized": 0.72,
      "weight": 0.035,
      "tier": "hypothesis",
      "evidence_refs": [],
      "rationale": "eval-0b01 marked this derived with no evidence; with no evidence_refs it is a hypothesis.",
      "below_min_evidence_tier": true
    },
    {
      "id": "session_quality",
      "raw": 0.7,
      "normalized": 0.7,
      "weight": 0.035,
      "tier": "hypothesis",
      "evidence_refs": []
    },
    {
      "id": "competition",
      "raw": 0.7,
      "normalized": 0.3,
      "weight": 0.025,
      "tier": "hypothesis",
      "evidence_refs": [
        "claim-0a05"
      ],
      "rationale": "Rested only on claim-0a01, now unsupported (claim-0a05). The market was not observed for this dimension.",
      "below_min_evidence_tier": true
    },
    {
      "id": "replayability",
      "raw": 0.8,
      "normalized": 0.8,
      "weight": 0.025,
      "tier": "hypothesis",
      "evidence_refs": []
    },
    {
      "id": "performance_risk",
      "raw": 0.5,
      "normalized": 0.5,
      "weight": 0.015,
      "tier": "hypothesis",
      "evidence_refs": []
    },
    {
      "id": "time_to_market",
      "raw": 18,
      "normalized": 0.84,
      "weight": 0.02,
      "tier": "derived",
      "evidence_refs": [
        "claim-0a02"
      ]
    },
    {
      "id": "iterability",
      "raw": 0.8,
      "normalized": 0.8,
      "weight": 0.005,
      "tier": "hypothesis",
      "evidence_refs": []
    }
  ],
  "aggregate": 0.703,
  "evidence_coverage": 0.246,
  "vetoes_fired": [
    {
      "criterion_id": "no_viable_platform",
      "measured": 1.0,
      "breached": false
    },
    {
      "criterion_id": "over_timebox",
      "measured": 11,
      "breached": false
    },
    {
      "criterion_id": "unevidenced_revenue",
      "measured": 0.58,
      "breached": false,
      "note": "Revenue is hypothesis-tier but below the 0.80 trigger, so the veto does not fire. It remains the weakest part of this case."
    },
    {
      "criterion_id": "asset_cost_exceeds_value",
      "measured": 320,
      "breached": false
    }
  ],
  "ranking_note": "Supersedes eval-0b01, which broke the evidence rules: claim-0a01 has no backing snapshot and describes a method rather than quoting its source (superseded by claim-0a05), claim-0a03 derives only from it (superseded by claim-0a06), and technical_risk and asset_cost were marked derived with no evidence. Every dimension resting on them is now a hypothesis at half weight. Arithmetic: aggregate = sum(weight x normalized) / sum(weight) over the effective weights = 0.703; evidence coverage = non-hypothesis weight / total weight = 0.246, below the model's 0.60 min_coverage. (eval-0b01 recorded 0.643; the same arithmetic over its own weights gives 0.68.) Only platform_fit (claim-0a02) and time_to_market remain evidenced. The kill decision already recorded at G4 is unaffected; this records what the evidence actually supported.",
  "supersedes_evaluation_id": "eval-0b01"
}
